{
  "$schema": "https://json-schema.org/draft/2020-12/schema",
  "$id": "https://local.shiguang.invalid/schemas/19-video-qc-output.json",
  "title": "19-video-qc-output",
  "type": "object",
  "additionalProperties": false,
  "properties": {
    "projectId": {
      "type": "string",
      "minLength": 1
    },
    "projectVersion": {
      "type": "integer",
      "minimum": 1
    },
    "payload": {
      "type": "object",
      "properties": {
        "passed": {},
        "score": {},
        "observedState": {},
        "risks": {}
      },
      "required": [
        "passed",
        "score",
        "observedState",
        "risks"
      ],
      "additionalProperties": true
    },
    "trace": {
      "type": "object",
      "additionalProperties": true
    },
    "status": {
      "enum": [
        "READY",
        "HUMAN_REVIEW_REQUIRED",
        "FAILED"
      ]
    },
    "warnings": {
      "type": "array",
      "items": {
        "type": "string"
      }
    }
  },
  "required": [
    "projectId",
    "projectVersion",
    "payload",
    "status",
    "warnings"
  ]
}
